{
  "$schema": "./config.schema.json",
  "configEnv": "ONYX_AUDIT_CONFIG",
  "url": "https://onyx.example.com/mcp",
  "tokenEnv": "ONYX_AUDIT_TOKEN",
  "searchTool": "search_indexed_documents",
  "arguments": {
    "limit": null
  },
  "staticArguments": {
    "search": {
      "skip_query_expansion": true
    }
  },
  "enabled": false
}
